[
  {
    "id": "tx-001",
    "payorId": "ent-001",
    "payeeId": "ent-002",
    "categoryId": "cat-003",
    "amount": 1200.0,
    "date": "2024-01-15",
    "description": "Monthly rent payment",
    "transactionState": "COMPLETED",
    "createdAt": "2024-01-01T00:00:00Z",
    "updatedAt": "2024-01-15T00:00:00Z"
  },
  {
    "id": "tx-002",
    "payorId": "ent-003",
    "payeeId": "ent-004",
    "categoryId": "cat-005",
    "amount": 60.0,
    "date": "2024-01-10",
    "description": "Internet bill payment",
    "transactionState": "PENDING",
    "createdAt": "2024-01-05T00:00:00Z",
    "updatedAt": "2024-01-10T00:00:00Z"
  },
  {
    "id": "tx-003",
    "payorId": "ent-005",
    "payeeId": "ent-006",
    "categoryId": "cat-007",
    "amount": 150.0,
    "date": "2024-01-20",
    "description": "Electricity bill payment",
    "transactionState": "SCHEDULED",
    "createdAt": "2024-01-10T00:00:00Z",
    "updatedAt": "2024-01-15T00:00:00Z"
  },
  {
    "id": "tx-004",
    "payorId": "ent-007",
    "payeeId": "ent-008",
    "categoryId": "cat-009",
    "amount": 200.0,
    "date": "2024-02-01",
    "description": "Car loan payment",
    "transactionState": "COMPLETED",
    "createdAt": "2024-01-25T00:00:00Z",
    "updatedAt": "2024-02-01T00:00:00Z"
  },
  {
    "id": "tx-005",
    "payorId": "ent-009",
    "payeeId": "ent-010",
    "categoryId": "cat-011",
    "amount": 100.0,
    "date": "2024-02-05",
    "description": "Utility bill payment",
    "transactionState": "COMPLETED",
    "createdAt": "2024-01-30T00:00:00Z",
    "updatedAt": "2024-02-05T00:00:00Z"
  },
  {
    "id": "tx-006",
    "payorId": "ent-011",
    "payeeId": "ent-012",
    "categoryId": "cat-013",
    "amount": 75.0,
    "date": "2024-02-10",
    "description": "Phone bill payment",
    "transactionState": "PENDING",
    "createdAt": "2024-02-01T00:00:00Z",
    "updatedAt": "2024-02-10T00:00:00Z"
  },
  {
    "id": "tx-007",
    "payorId": "ent-013",
    "payeeId": "ent-014",
    "categoryId": "cat-014",
    "amount": 350.0,
    "date": "2024-02-15",
    "description": "Health insurance premium",
    "transactionState": "SCHEDULED",
    "createdAt": "2024-02-01T00:00:00Z",
    "updatedAt": "2024-02-15T00:00:00Z"
  },
  {
    "id": "tx-008",
    "payorId": "ent-015",
    "payeeId": "ent-016",
    "categoryId": "cat-015",
    "amount": 500.0,
    "date": "2024-02-20",
    "description": "Credit card payment",
    "transactionState": "COMPLETED",
    "createdAt": "2024-02-10T00:00:00Z",
    "updatedAt": "2024-02-20T00:00:00Z"
  },
  {
    "id": "tx-009",
    "payorId": "ent-017",
    "payeeId": "ent-018",
    "categoryId": "cat-016",
    "amount": 45.0,
    "date": "2024-02-25",
    "description": "Monthly gym membership",
    "transactionState": "COMPLETED",
    "createdAt": "2024-02-15T00:00:00Z",
    "updatedAt": "2024-02-25T00:00:00Z"
  },
  {
    "id": "tx-010",
    "payorId": "ent-019",
    "payeeId": "ent-020",
    "categoryId": "cat-017",
    "amount": 1500.0,
    "date": "2024-03-01",
    "description": "Rent payment",
    "transactionState": "COMPLETED",
    "createdAt": "2024-02-20T00:00:00Z",
    "updatedAt": "2024-03-01T00:00:00Z"
  }
]
